{
    "target":  "x86_64-pc-windows-msvc",
    "runtime":  "ori_runtime.lib",
    "runtime_cdylib":  "ori_runtime.dll",
    "ori_version":  "0.3.8",
    "abi_version":  "ori-native-abi-1",
    "profile":  "debug",
    "native_static_libs":  [
                               "C:\\Users\\raillen.DESKTOP-99RJ5M6\\Documents\\Projetos\\ori-lang\\packages\\ori-game\\lib\\x86_64-pc-windows-msvc\\raylib.lib",
                               "legacy_stdio_definitions.lib",
                               "kernel32.lib",
                               "ntdll.lib",
                               "userenv.lib",
                               "ws2_32.lib",
                               "dbghelp.lib",
                               "opengl32.lib",
                               "gdi32.lib",
                               "user32.lib",
                               "winmm.lib",
                               "shell32.lib",
                               "shlwapi.lib",
                               "ole32.lib",
                               "oleaut32.lib",
                               "imm32.lib",
                               "setupapi.lib",
                               "version.lib",
                               "/defaultlib:msvcrt"
                           ],
    "generated_by":  "tools/stage_native_runtime.ps1"
}
